{
  "schemaVersion": "1.0",
  "workflowId": "top-skill-2-codegen-dogfood",
  "runId": "2026-05-14-driver-status-badge-codegen",
  "passId": "executive",
  "role": "executive",
  "taskCapsuleRef": "capsules/executive.task-capsule.json",
  "handoffArtifactRef": "handoffs/executive.handoff.json",
  "inputReferences": [
    "examples/driver-status-badge/README.md",
    "examples/driver-status-badge/DriverStatusBadgeController.ts",
    "examples/driver-status-badge/DriverStatusBadgeControllerAccess.ts",
    "examples/driver-status-badge/DriverStatusBadgeContent.ts",
    "examples/driver-status-badge/driver-status-badge.tree.json",
    "workflow/run-package-layout.md",
    "top/validation/output-rules.md",
    "SKILL.md",
    "CHANGELOG.md",
    "skill.json",
    "top/spec.json"
  ],
  "contextSlices": [
    "This is a real generated-code dogfood run for top-skill 2.0 orchestration.",
    "The generated fixture is examples/driver-status-badge/.",
    "The executive pass must not edit files through the LLM adapter; it records scoped generated artifacts and stops.",
    "Do not validate your own output and do not claim runner-enforced isolation."
  ],
  "forbiddenInputs": [
    "full prior chat transcript unless explicitly listed in inputReferences",
    "unbounded agent memory",
    "implementation files outside task capsule scope unless explicitly referenced"
  ],
  "materializedBy": "top-protocol-runner",
  "materializedAt": "2026-05-14T19:37:34Z",
  "contextHash": "a1347ab5626f5eaa37c74df60c9f2bde55acd2730e29e55f9b6e47bf92065f20",
  "limitations": [
    "Context package records bounded inputs; it does not by itself prove LLM context isolation."
  ]
}
