{
  "schemaVersion": "1.0",
  "workflowId": "top-skill-2-repair-loop-dogfood",
  "runId": "2026-05-14-repair-loop-dogfood-3",
  "passId": "judicial-initial",
  "role": "judicial",
  "taskCapsuleRef": "capsules/judicial-initial.task-capsule.json",
  "handoffArtifactRef": "handoffs/judicial-initial.handoff.json",
  "inputReferences": [
    "handoffs/executive.handoff.json",
    "invocations/executive.invocation-evidence.json"
  ],
  "contextSlices": [
    "Validate only the artifacts and handoffs explicitly listed in inputReferences.",
    "If this is the final judicial pass, validate post-repair artifacts and ignore repair self-claims.",
    "The runner report is produced after pass execution, so do not require it inside this judicial pass.",
    "Use status done when the judicial handoff is complete; done is not a delivery certification claim.",
    "Do not repair implementation artifacts and do not certify delivery."
  ],
  "forbiddenInputs": [
    "full prior chat transcript unless explicitly listed in inputReferences",
    "unbounded agent memory",
    "implementation files outside task capsule scope unless explicitly referenced"
  ],
  "materializedBy": "top-protocol-runner",
  "materializedAt": "2026-05-15T00:58:20Z",
  "contextHash": "48331b3fd7b22c42f2f1ac9badc406670dbf961ec49e9800d6da62bd43d61911",
  "limitations": [
    "Context package records bounded inputs; it does not by itself prove LLM context isolation."
  ]
}
