{
  "schemaVersion": "1.0",
  "workflowId": "top-skill-2-repair-loop-dogfood",
  "runId": "2026-05-14-repair-loop-dogfood",
  "passId": "executive",
  "role": "executive",
  "taskCapsuleRef": "capsules/executive.task-capsule.json",
  "handoffArtifactRef": "handoffs/executive.handoff.json",
  "inputReferences": [],
  "contextSlices": [
    "fill with minimal required context before launch"
  ],
  "forbiddenInputs": [
    "full prior chat transcript unless explicitly listed in inputReferences",
    "unbounded agent memory",
    "implementation files outside task capsule scope unless explicitly referenced"
  ],
  "materializedBy": "top-protocol-runner",
  "materializedAt": "2026-05-15T00:52:44Z",
  "contextHash": "021e429e45f6f5b4bff320daf9c4f98e6c8b02be8c575e1e21af744beddc05fc",
  "limitations": [
    "Context package records bounded inputs; it does not by itself prove LLM context isolation."
  ]
}
