{
  "schemaVersion": "1.0",
  "workflowId": "top-skill-2-orchestration",
  "runId": "2026-05-12-activation-pilot",
  "passId": "executive",
  "role": "executive",
  "taskCapsuleRef": "capsules/executive.task-capsule.json",
  "handoffArtifactRef": "handoffs/executive.handoff.json",
  "inputReferences": [
    "workflow/enforcement-evidence-model.md",
    "workflow/run-package-layout.md",
    "workflow/orchestrator-protocol.md",
    "scripts/create_orchestration_run.py",
    "top/artifact-manifest.json",
    "top/modes/mode-manifest.json",
    "hydration-manifest.json"
  ],
  "contextSlices": [
    "Only update protocol-layer orchestration governance.",
    "Do not touch React Native or private TOP target rules.",
    "Keep the result protocol-only; do not claim runner-enforced isolation."
  ],
  "forbiddenInputs": [
    "full prior chat transcript unless explicitly listed in inputReferences",
    "unbounded agent memory",
    "implementation files outside task capsule scope unless explicitly referenced"
  ],
  "materializedBy": "top-protocol-runner",
  "materializedAt": "2026-05-13T08:48:56Z",
  "contextHash": "8ff29049317848eff10f12dc164fc06a8046adb4bf822968d86a305c81dca63b",
  "limitations": [
    "Context package records bounded inputs; it does not by itself prove LLM context isolation."
  ]
}
